id,text_to_embed
G0018,"admin@338(admin@338 is a China-based cyber threat group. It has previously used newsworthy events as lures to deliver malware and has primarily targeted organizations involved in financial, economic, and trade policy, typically using publicly available RATs such as PoisonIvy, as well as some non-public backdoors.) using the following: LOWBALL(LOWBALL is malware used by admin@338. It was used in August 2015 in email messages targeting Hong Kong-based media organizations.), BUBBLEWRAP(BUBBLEWRAP is a full-featured, second-stage backdoor used by the admin@338 group. It is set to run when the system boots and includes functionality to check, upload, and register plug-ins that can further enhance its capabilities.)"
G1007,"Aoqin Dragon(Aoqin Dragon is a suspected Chinese cyber espionage threat group that has been active since at least 2013. Aoqin Dragon has primarily targeted government, education, and telecommunication organizations in Australia, Cambodia, Hong Kong, Singapore, and Vietnam. Security researchers noted a potential association between Aoqin Dragon and UNC94, based on malware, infrastructure, and targets.) using the following: Heyoka Backdoor(Heyoka Backdoor is a custom backdoor--based on the Heyoka open source exfiltration tool--that  has been used by Aoqin Dragon since at least 2013.), Mongall(Mongall is a backdoor that has been used since at least 2013, including by Aoqin Dragon.)"
G0099,"APT-C-36(APT-C-36 is a suspected South America espionage group that has been active since at least 2018. The group mainly targets Colombian government institutions as well as important corporations in the financial sector, petroleum industry, and professional manufacturing.) using the following: Operation Spalax(Operation Spalax was a campaign that primarily targeted Colombian government organizations and private companies, particularly those associated with the energy and metallurgical industries. The Operation Spalax threat actors distributed commodity malware and tools using generic phishing topics related to COVID-19, banking, and law enforcement action. Security researchers noted indicators of compromise and some infrastructure overlaps with other campaigns dating back to April 2018, including at least one separately attributed to APT-C-36, however identified enough differences to report this as separate, unattributed activity.)"
G0006,"APT1(APT1 is a Chinese threat group that has been attributed to the 2nd Bureau of the People’s Liberation Army (PLA) General Staff Department’s (GSD) 3rd Department, commonly known by its Military Unit Cover Designator (MUCD) as Unit 61398.) using the following: CALENDAR(CALENDAR is malware used by APT1 that mimics legitimate Gmail Calendar traffic.), ELMER(ELMER is a non-persistent, proxy-aware HTTP backdoor written in Delphi that has been used by APT16.), RIPTIDE(RIPTIDE is a proxy-aware backdoor used by APT12.), GLOOXMAIL(GLOOXMAIL is malware used by APT1 that mimics legitimate Jabber/XMPP traffic.), Seasalt(Seasalt is malware that has been linked to APT1's 2010 operations. It shares some code similarities with OceanSalt.), Hydraq(Hydraq is a data-theft trojan first used by Elderwood in the 2009 Google intrusion known as Operation Aurora, though variations of this trojan have been used in more recent campaigns by other Chinese actors, possibly including APT17.), hcdLoader(hcdLoader is a remote access tool (RAT) that has been used by APT18.), OceanSalt(OceanSalt is a Trojan that was used in a campaign targeting victims in South Korea, United States, and Canada. OceanSalt shares code similarity with SpyNote RAT, which has been linked to APT1.), Pisloader(Pisloader is a malware family that is notable due to its use of DNS as a C2 protocol as well as its use of anti-analysis tactics. It has been used by APT18 and is similar to another malware family, HTTPBrowser, that has been used by the group.), BISCUIT(BISCUIT is a backdoor that has been used by APT1 since as early as 2007.), WEBC2(WEBC2 is a family of backdoor malware used by APT1 as early as July 2006. WEBC2 backdoors are designed to retrieve a webpage, with commands hidden in HTML comments or special tags, from a predetermined C2 server.)"
G0005,"APT12(APT12 is a threat group that has been attributed to China. The group has targeted a variety of victims including but not limited to media outlets, high-tech companies, and multiple governments.) using the following: RIPTIDE(RIPTIDE is a proxy-aware backdoor used by APT12.)"
G0023,"APT16(APT16 is a China-based threat group that has launched spearphishing campaigns targeting Japanese and Taiwanese organizations.) using the following: ELMER(ELMER is a non-persistent, proxy-aware HTTP backdoor written in Delphi that has been used by APT16.)"
G0025,"APT17(APT17 is a China-based threat group that has conducted network intrusions against U.S. government entities, the defense industry, law firms, information technology companies, mining companies, and non-government organizations.) using the following: Hydraq(Hydraq is a data-theft trojan first used by Elderwood in the 2009 Google intrusion known as Operation Aurora, though variations of this trojan have been used in more recent campaigns by other Chinese actors, possibly including APT17.)"
G0026,"APT18(APT18 is a threat group that has operated since at least 2009 and has targeted a range of industries, including technology, manufacturing, human rights groups, government, and medical.) using the following: Pisloader(Pisloader is a malware family that is notable due to its use of DNS as a C2 protocol as well as its use of anti-analysis tactics. It has been used by APT18 and is similar to another malware family, HTTPBrowser, that has been used by the group.), hcdLoader(hcdLoader is a remote access tool (RAT) that has been used by APT18.)"
G0007,"APT28(APT28 is a threat group that has been attributed to Russia's General Staff Main Intelligence Directorate (GRU) 85th Main Special Service Center (GTsSS) military unit 26165. This group has been active since at least 2004.APT28 reportedly compromised the Hillary Clinton campaign, the Democratic National Committee, and the Democratic Congressional Campaign Committee in 2016 in an attempt to interfere with the U.S. presidential election.  In 2018, the US indicted five GRU Unit 26165 officers associated with APT28 for cyber operations (including close-access operations) conducted between 2014 and 2018 against the World Anti-Doping Agency (WADA), the US Anti-Doping Agency, a US nuclear facility, the Organization for the Prohibition of Chemical Weapons (OPCW), the Spiez Swiss Chemicals Laboratory, and other organizations. Some of these were conducted with the assistance of GRU Unit 74455, which is also referred to as Sandworm Team.) using the following: CHOPSTICK(CHOPSTICK is a malware family of modular backdoors used by APT28. It has been used since at least 2012 and is usually dropped on victims as second-stage malware, though it has been used as first-stage malware in several cases. It has both Windows and Linux variants.     It is tracked separately from the X-Agent for Android.), OLDBAIT(OLDBAIT is a credential harvester used by APT28.), XTunnel(XTunnel a VPN-like network proxy tool that can relay traffic between a C2 server and a victim. It was first seen in May 2013 and reportedly used by APT28 during the compromise of the Democratic National Committee.), JHUHUGIT(JHUHUGIT is malware used by APT28. It is based on Carberp source code and serves as reconnaissance malware.), USBStealer(USBStealer is malware that has been used by APT28 since at least 2005 to extract information from air-gapped networks. It does not have the capability to communicate over the Internet and has been used in conjunction with ADVSTORESHELL.), Zebrocy(Zebrocy is a Trojan that has been used by APT28 since at least November 2015. The malware comes in several programming language variants, including C++, Delphi, AutoIt, C#, VB.NET, and Golang.), HIDEDRV(HIDEDRV is a rootkit used by APT28. It has been deployed along with Downdelph to execute and hide that malware.), Downdelph(Downdelph is a first-stage downloader written in Delphi that has been used by APT28 in rare instances between 2013 and 2015.), LoJax(LoJax is a UEFI rootkit used by APT28 to persist remote access software on targeted systems.), ADVSTORESHELL(ADVSTORESHELL is a spying backdoor that has been used by APT28 from at least 2012 to 2016. It is generally used for long-term espionage and is deployed on targets deemed interesting after a reconnaissance phase.), DealersChoice(DealersChoice is a Flash exploitation framework used by APT28.), Komplex(Komplex is a backdoor that has been used by APT28 on OS X and appears to be developed in a similar manner to XAgentOSX  .), CORESHELL(CORESHELL is a downloader used by APT28. The older versions of this malware are known as SOURFACE and newer versions as CORESHELL.), Fysbis(Fysbis is a Linux-based backdoor used by APT28 that dates back to at least 2014.), XAgentOSX(XAgentOSX is a trojan that has been used by APT28  on OS X and appears to be a port of their standard CHOPSTICK or XAgent trojan.), Drovorub(Drovorub is a Linux malware toolset comprised of an agent, client, server, and kernel modules, that has been used by APT28.)"
G0016,"APT29(APT29 is threat group that has been attributed to Russia's Foreign Intelligence Service (SVR). They have operated since at least 2008, often targeting government networks in Europe and NATO member countries, research institutes, and think tanks. APT29 reportedly compromised the Democratic National Committee starting in the summer of 2015.In April 2021, the US and UK governments attributed the SolarWinds Compromise to the SVR; public statements included citations to APT29, Cozy Bear, and The Dukes. Industry reporting also referred to the actors involved in this campaign as UNC2452, NOBELIUM, StellarParticle, Dark Halo, and SolarStorm.) using the following: SUNSPOT(SUNSPOT is an implant that injected the SUNBURST backdoor into the SolarWinds Orion software update framework. It was used by APT29 since at least February 2020.), POSHSPY(POSHSPY is a backdoor that has been used by APT29 since at least 2015. It appears to be used as a secondary backdoor used if the actors lost access to their primary backdoors.), TrailBlazer(TrailBlazer is a modular malware that has been used by APT29 since at least 2019.), WellMail(WellMail is a lightweight malware written in Golang used by APT29, similar in design and structure to WellMess.), EnvyScout(EnvyScout is a dropper that has been used by APT29 since at least 2021.), FoggyWeb(FoggyWeb is a passive and highly-targeted backdoor capable of remotely exfiltrating sensitive information from a compromised Active Directory Federated Services (AD FS) server. It has been used by APT29 since at least early April 2021.), CosmicDuke(CosmicDuke is malware that was used by APT29 from 2010 to 2015.), BoomBox(BoomBox is a downloader responsible for executing next stage components that has been used by APT29 since at least 2021.), SUNBURST(SUNBURST is a trojanized DLL designed to fit within the SolarWinds Orion software update framework. It was used by APT29 since at least February 2020.), Sibot(Sibot is dual-purpose malware written in VBScript designed to achieve persistence on a compromised system as well as download and execute additional payloads. Microsoft discovered three Sibot variants in early 2021 during its investigation of APT29 and the SolarWinds Compromise.), Raindrop(Raindrop is a loader used by APT29 that was discovered on some victim machines during investigations related to the SolarWinds Compromise. It was discovered in January 2021 and was likely used since at least May 2020.), OnionDuke(OnionDuke is malware that was used by APT29 from 2013 to 2015.), SolarWinds Compromise(The SolarWinds Compromise was a sophisticated supply chain cyber operation conducted by APT29 that was discovered in mid-December 2020. APT29 used customized malware to inject malicious code into the SolarWinds Orion software build process that was later distributed through a normal software update; they also used password spraying, token theft, API abuse, spear phishing, and other supply chain attacks to compromise user accounts and leverage their associated access. Victims of this campaign included government, consulting, technology, telecom, and other organizations in North America, Europe, Asia, and the Middle East. Industry reporting initially referred to the actors involved in this campaign as UNC2452, NOBELIUM, StellarParticle, Dark Halo, and SolarStorm. In April 2021, the US and UK governments attributed the SolarWinds Compromise to Russia's Foreign Intelligence Service (SVR); public statements included citations to APT29, Cozy Bear, and The Dukes. The US government assessed that of the approximately 18,000 affected public and private sector customers of Solar Winds’ Orion product, a much smaller number were compromised by follow-on APT29 activity on their systems.), PolyglotDuke(PolyglotDuke is a downloader that has been used by APT29 since at least 2013. PolyglotDuke has been used to drop MiniDuke.), Operation Ghost(Operation Ghost was an APT29 campaign starting in 2013 that included operations against ministries of foreign affairs in Europe and the Washington, D.C. embassy of a European Union country. During Operation Ghost, APT29 used new families of malware and leveraged web services, steganography, and unique C2 infrastructure for each victim.), VaporRage(VaporRage is a shellcode downloader that has been used by APT29 since at least 2021.), RegDuke(RegDuke is a first stage implant written in .NET and used by APT29 since at least 2017. RegDuke has been used to control a compromised machine when control of other implants on the machine was lost.), GoldFinder(GoldFinder is a custom HTTP tracer tool written in Go that logs the route a packet takes between a compromised network and a C2 server. It can be used to inform  threat actors of potential points of discovery or logging of their actions, including C2 related to other malware. GoldFinder was discovered in early 2021 during an investigation into the SolarWinds Compromise by APT29.), HAMMERTOSS(HAMMERTOSS is a backdoor that was used by APT29 in 2015.), MiniDuke(MiniDuke is malware that was used by APT29 from 2010 to 2015. The MiniDuke toolset consists of multiple downloader and backdoor components. The loader has been used with other MiniDuke components as well as in conjunction with CosmicDuke and PinchDuke.), GoldMax(GoldMax is a second-stage C2 backdoor written in Go with Windows and Linux variants that are nearly identical in functionality. GoldMax was discovered in early 2021 during the investigation into the SolarWinds Compromise, and has likely been used by APT29 since at least mid-2019. GoldMax uses multiple defense evasion techniques, including avoiding virtualization execution and masking malicious traffic.), PinchDuke(PinchDuke is malware that was used by APT29 from 2008 to 2010.), C0021(C0021 was a spearphishing campaign conducted in November 2018 that targeted public sector institutions, non-governmental organizations (NGOs), educational institutions, and private-sector corporations in the oil and gas, chemical, and hospitality industries. The majority of targets were located in the US, particularly in and around Washington D.C., with other targets located in Europe, Hong Kong, India, and Canada. C0021's technical artifacts, tactics, techniques, and procedures (TTPs), and targeting overlap with previous suspected APT29 activity.), LiteDuke(LiteDuke is a third stage backdoor that was used by APT29, primarily in 2014-2015. LiteDuke used the same dropper as PolyglotDuke, and was found on machines also compromised by MiniDuke.), CozyCar(CozyCar is malware that was used by APT29 from 2010 to 2015. It is a modular malware platform, and its backdoor component can be instructed to download and execute a variety of modules with different functionality.), TEARDROP(TEARDROP is a memory-only dropper that was discovered on some victim machines during investigations related to the SolarWinds Compromise. It was likely used by APT29 since at least May 2020.), SUPERNOVA(SUPERNOVA is an in-memory web shell written in .NET C#. It was discovered in November 2020 during the investigation of APT29's SolarWinds cyber operation but determined to be unrelated. Subsequent analysis suggests SUPERNOVA may have been used by the China-based threat group SPIRAL.), NativeZone(NativeZone is the name given collectively to disposable custom Cobalt Strike loaders used by APT29 since at least 2021.), PowerDuke(PowerDuke is a backdoor that was used by APT29 in 2016. It has primarily been delivered through Microsoft Word or Excel attachments containing malicious macros.), SeaDuke(SeaDuke is malware that was used by APT29 from 2014 to 2015. It was used primarily as a secondary backdoor for victims that were already compromised with CozyCar.), FatDuke(FatDuke is a backdoor used by APT29 since at least 2016.), CloudDuke(CloudDuke is malware that was used by APT29 in 2015.), GeminiDuke(GeminiDuke is malware that was used by APT29 from 2009 to 2012.), SoreFang(SoreFang is first stage downloader used by APT29 for exfiltration and to load other malware.), WellMess(WellMess is lightweight malware family with variants written in .NET and Golang that has been in use since at least 2018 by APT29.)"
G0022,"APT3(APT3 is a China-based threat group that researchers have attributed to China's Ministry of State Security. This group is responsible for the campaigns known as Operation Clandestine Fox, Operation Clandestine Wolf, and Operation Double Tap. As of June 2015, the group appears to have shifted from targeting primarily US victims to primarily political organizations in Hong Kong.In 2017, MITRE developed an APT3 Adversary Emulation Plan.) using the following: SHOTPUT(SHOTPUT is a custom backdoor used by APT3.), NOKKI(NOKKI is a modular remote access tool. The earliest observed attack using NOKKI was in January 2018. NOKKI has significant code overlap with the KONNI malware family. There is some evidence potentially linking NOKKI to APT37.), KONNI(KONNI is a remote access tool that security researchers assess has been used by North Korean cyber actors since at least 2014. KONNI has significant code overlap with the NOKKI malware family, and has been linked to several suspected North Korean campaigns targeting political organizations in Russia, East Asia, Europe and the Middle East; there is some evidence potentially linking KONNI to APT37.), Denis(Denis is a Windows backdoor and Trojan used by APT32. Denis shares several similarities to the SOUNDBITE backdoor and has been used in conjunction with the Goopy backdoor.), Cadelspy(Cadelspy is a backdoor that has been used by APT39.), POORAIM(POORAIM is a backdoor used by APT37 in campaigns since at least 2014.), SLOWDRIFT(SLOWDRIFT is a backdoor used by APT37 against academic and strategic victims in South Korea.), KOMPROGO(KOMPROGO is a signature backdoor used by APT32 that is capable of process, file, and registry management.), FLASHFLOOD(FLASHFLOOD is malware developed by APT30 that allows propagation and exfiltration of data over removable devices. APT30 may use this capability to exfiltrate data across air-gaps.), DOGCALL(DOGCALL is a backdoor used by APT37 that has been used to target South Korean government and military organizations in 2017. It is typically dropped using a Hangul Word Processor (HWP) exploit.), BACKSPACE(BACKSPACE is a backdoor used by APT30 that dates back to at least 2005.), SHUTTERSPEED(SHUTTERSPEED is a backdoor used by APT37.), ROKRAT(ROKRAT is a cloud-based remote access tool (RAT) used by APT37 to target victims in South Korea. APT37 has used ROKRAT during several campaigns from 2016 through 2021.), NETEAGLE(NETEAGLE is a backdoor developed by APT30 with compile dates as early as 2008. It has two main variants known as ""Scout"" and ""Norton.""), Goopy(Goopy is a Windows backdoor and Trojan used by APT32 and shares several similarities to another backdoor used by the group (Denis). Goopy is named for its impersonation of the legitimate Google Updater executable.), MechaFlounder(MechaFlounder is a python-based remote access tool (RAT) that has been used by APT39. The payload uses a combination of actor developed code and code snippets freely available online in development communities.), StoneDrill(StoneDrill is wiper malware discovered in destructive campaigns against both Middle Eastern and European targets in association with APT33.), HAPPYWORK(HAPPYWORK is a downloader used by APT37 to target South Korean government and financial victims in November 2016.), BLUELIGHT(BLUELIGHT is a remote access Trojan used by APT37 that was first observed in early 2021.), CORALDECK(CORALDECK is an exfiltration tool used by APT37.), SOUNDBITE(SOUNDBITE is a signature backdoor used by APT32.), Kerrdown(Kerrdown is a custom downloader that has been used by APT32 since at least 2018 to install spyware from a server on the victim's network.), PHOREAL(PHOREAL is a signature backdoor used by APT32.), SPACESHIP(SPACESHIP is malware developed by APT30 that allows propagation and exfiltration of data over removable devices. APT30 may use this capability to exfiltrate data across air-gaps.), POWERTON(POWERTON is a custom PowerShell backdoor first observed in 2018. It has typically been deployed as a late-stage backdoor by APT33. At least two variants of the backdoor have been identified, with the later version containing improved functionality.), OSInfo(OSInfo is a custom tool used by APT3 to do internal discovery on a victim's computer and network.), WINERACK(WINERACK is a backdoor used by APT37.), OSX_OCEANLOTUS.D(OSX_OCEANLOTUS.D is a MacOS backdoor with several variants that has been used by APT32.), WINDSHIELD(WINDSHIELD is a signature backdoor used by APT32.), SHIPSHAPE(SHIPSHAPE is malware developed by APT30 that allows propagation and exfiltration of data over removable devices. APT30 may use this capability to exfiltrate data across air-gaps.), KARAE(KARAE is a backdoor typically used by APT37 as first-stage malware.), RemoteCMD(RemoteCMD is a custom tool used by APT3 to execute commands on a remote system similar to SysInternal's PSEXEC functionality.), TURNEDUP(TURNEDUP is a non-public backdoor. It has been dropped by APT33's StoneDrill malware.)"
G0013,"APT30(APT30 is a threat group suspected to be associated with the Chinese government. While Naikon shares some characteristics with APT30, the two groups do not appear to be exact matches.) using the following: FLASHFLOOD(FLASHFLOOD is malware developed by APT30 that allows propagation and exfiltration of data over removable devices. APT30 may use this capability to exfiltrate data across air-gaps.), BACKSPACE(BACKSPACE is a backdoor used by APT30 that dates back to at least 2005.), SPACESHIP(SPACESHIP is malware developed by APT30 that allows propagation and exfiltration of data over removable devices. APT30 may use this capability to exfiltrate data across air-gaps.), SHIPSHAPE(SHIPSHAPE is malware developed by APT30 that allows propagation and exfiltration of data over removable devices. APT30 may use this capability to exfiltrate data across air-gaps.), NETEAGLE(NETEAGLE is a backdoor developed by APT30 with compile dates as early as 2008. It has two main variants known as ""Scout"" and ""Norton."")"
G0050,"APT32(APT32 is a suspected Vietnam-based threat group that has been active since at least 2014. The group has targeted multiple private sector industries as well as foreign governments, dissidents, and journalists with a strong focus on Southeast Asian countries like Vietnam, the Philippines, Laos, and Cambodia. They have extensively used strategic web compromises to compromise victims.) using the following: Kerrdown(Kerrdown is a custom downloader that has been used by APT32 since at least 2018 to install spyware from a server on the victim's network.), WINDSHIELD(WINDSHIELD is a signature backdoor used by APT32.), KOMPROGO(KOMPROGO is a signature backdoor used by APT32 that is capable of process, file, and registry management.), Denis(Denis is a Windows backdoor and Trojan used by APT32. Denis shares several similarities to the SOUNDBITE backdoor and has been used in conjunction with the Goopy backdoor.), OSX_OCEANLOTUS.D(OSX_OCEANLOTUS.D is a MacOS backdoor with several variants that has been used by APT32.), PHOREAL(PHOREAL is a signature backdoor used by APT32.), SOUNDBITE(SOUNDBITE is a signature backdoor used by APT32.), Goopy(Goopy is a Windows backdoor and Trojan used by APT32 and shares several similarities to another backdoor used by the group (Denis). Goopy is named for its impersonation of the legitimate Google Updater executable.)"
G0064,"APT33(APT33 is a suspected Iranian threat group that has carried out operations since at least 2013. The group has targeted organizations across multiple industries in the United States, Saudi Arabia, and South Korea, with a particular interest in the aviation and energy sectors.) using the following: POWERTON(POWERTON is a custom PowerShell backdoor first observed in 2018. It has typically been deployed as a late-stage backdoor by APT33. At least two variants of the backdoor have been identified, with the later version containing improved functionality.), StoneDrill(StoneDrill is wiper malware discovered in destructive campaigns against both Middle Eastern and European targets in association with APT33.), TURNEDUP(TURNEDUP is a non-public backdoor. It has been dropped by APT33's StoneDrill malware.)"
