id,text_to_embed
G0067,"APT37(APT37 is a North Korean state-sponsored cyber espionage group that has been active since at least 2012. The group has targeted victims primarily in South Korea, but also in Japan, Vietnam, Russia, Nepal, China, India, Romania, Kuwait, and other parts of the Middle East. APT37 has also been linked to the following campaigns between 2016-2018: Operation Daybreak, Operation Erebus, Golden Time, Evil New Year, Are you Happy?, FreeMilk, North Korean Human Rights, and Evil New Year 2018.North Korean group definitions are known to have significant overlap, and some security researchers report all North Korean state-sponsored cyber activity under the name Lazarus Group instead of tracking clusters or subgroups.) using the following: WINERACK(WINERACK is a backdoor used by APT37.), ROKRAT(ROKRAT is a cloud-based remote access tool (RAT) used by APT37 to target victims in South Korea. APT37 has used ROKRAT during several campaigns from 2016 through 2021.), BLUELIGHT(BLUELIGHT is a remote access Trojan used by APT37 that was first observed in early 2021.), POORAIM(POORAIM is a backdoor used by APT37 in campaigns since at least 2014.), KARAE(KARAE is a backdoor typically used by APT37 as first-stage malware.), CORALDECK(CORALDECK is an exfiltration tool used by APT37.), NOKKI(NOKKI is a modular remote access tool. The earliest observed attack using NOKKI was in January 2018. NOKKI has significant code overlap with the KONNI malware family. There is some evidence potentially linking NOKKI to APT37.), HAPPYWORK(HAPPYWORK is a downloader used by APT37 to target South Korean government and financial victims in November 2016.), SHUTTERSPEED(SHUTTERSPEED is a backdoor used by APT37.), SLOWDRIFT(SLOWDRIFT is a backdoor used by APT37 against academic and strategic victims in South Korea.), DOGCALL(DOGCALL is a backdoor used by APT37 that has been used to target South Korean government and military organizations in 2017. It is typically dropped using a Hangul Word Processor (HWP) exploit.), KONNI(KONNI is a remote access tool that security researchers assess has been used by North Korean cyber actors since at least 2014. KONNI has significant code overlap with the NOKKI malware family, and has been linked to several suspected North Korean campaigns targeting political organizations in Russia, East Asia, Europe and the Middle East; there is some evidence potentially linking KONNI to APT37.)"
G0087,"APT39(APT39 is one of several names for cyber espionage activity conducted by the Iranian Ministry of Intelligence and Security (MOIS) through the front company Rana Intelligence Computing since at least 2014. APT39 has primarily targeted the travel, hospitality, academic, and telecommunications industries in Iran and across Asia, Africa, Europe, and North America to track individuals and entities considered to be a threat by the MOIS.) using the following: Cadelspy(Cadelspy is a backdoor that has been used by APT39.), MechaFlounder(MechaFlounder is a python-based remote access tool (RAT) that has been used by APT39. The payload uses a combination of actor developed code and code snippets freely available online in development communities.)"
G0096,"APT41(APT41 is a threat group that researchers have assessed as Chinese state-sponsored espionage group that also conducts financially-motivated operations. Active since at least 2012, APT41 has been observed targeting healthcare, telecom, technology, and video game industries in 14 countries. APT41 overlaps at least partially with public reporting on groups including BARIUM and Winnti Group.) using the following: MESSAGETAP(MESSAGETAP is a data mining malware family deployed by APT41 into telecommunications networks to monitor and save SMS traffic from specific phone numbers, IMSI numbers, or that contain specific keywords.), DEADEYE(DEADEYE is a malware launcher that has been used by APT41 since at least May 2021. DEADEYE has variants that can either embed a payload inside a compiled binary (DEADEYE.EMBED) or append it to the end of a file (DEADEYE.APPEND).), Operation CuckooBees(Operation CuckooBees was a cyber espionage campaign targeting technology and manufacturing companies in East Asia, Western Europe, and North America since at least 2019. Security researchers noted the goal of Operation CuckooBees, which was still ongoing as of May 2022, was likely the theft of proprietary information, research and development documents, source code, and blueprints for various technologies. Researchers assessed Operation CuckooBees was conducted by actors affiliated with Winnti Group, APT41, and BARIUM.), KEYPLUG(KEYPLUG is a modular backdoor written in C++, with Windows and Linux variants, that has been used by APT41 since at least June 2021.), ShadowPad(ShadowPad is a modular backdoor that was first identified in a supply chain compromise of the NetSarang software in mid-July 2017. The malware was originally thought to be exclusively used by APT41, but has since been observed to be used by various Chinese threat activity groups.), C0017(C0017 was an APT41 campaign conducted between May 2021 and February 2022 that successfully compromised at least six U.S. state government networks through the exploitation of vulnerable Internet facing web applications. During C0017, APT41 was quick to adapt and use publicly-disclosed as well as zero-day vulnerabilities for initial access, and in at least two cases re-compromised victims following remediation efforts. The goals of C0017 are unknown, however APT41 was observed exfiltrating Personal Identifiable Information (PII).)"
G0001,"Axiom(Axiom is a suspected Chinese cyber espionage group that has targeted the aerospace, defense, government, manufacturing, and media sectors since at least 2008. Some reporting suggests a degree of overlap between Axiom and Winnti Group but the two groups appear to be distinct based on differences in reporting on TTPs and targeting.) using the following: Hikit(Hikit is malware that has been used by Axiom for late-stage persistence and exfiltration after the initial compromise.), Zox(Zox is a remote access tool that has been used by Axiom since at least 2008.)"
G0135,"BackdoorDiplomacy(BackdoorDiplomacy is a cyber espionage threat group that has been active since at least 2017. BackdoorDiplomacy has targeted Ministries of Foreign Affairs and telecommunication companies in Africa, Europe, the Middle East, and Asia.) using the following: Turian(Turian is a backdoor that has been used by BackdoorDiplomacy to target Ministries of Foreign Affairs, telecommunication companies, and charities in Africa, Europe, the Middle East, and Asia. First reported in 2021, Turian is likely related to Quarian, an older backdoor that was last observed being used in 2013 against diplomatic targets in Syria and the United States.)"
G1002,"BITTER(BITTER is a suspected South Asian cyber espionage threat group that has been active since at least 2013. BITTER has primarily targeted government, energy, and engineering organizations in Pakistan, China, Bangladesh, and Saudi Arabia.) using the following: ZxxZ(ZxxZ is a trojan written in Visual C++ that has been used by BITTER since at least August 2021, including against Bangladeshi government personnel.)"
G0098,"BlackTech(BlackTech is a suspected Chinese cyber espionage group that has primarily targeted organizations in East Asia--particularly Taiwan, Japan, and Hong Kong--and the US since at least 2013. BlackTech has used a combination of custom malware, dual-use tools, and living off the land tactics to compromise media, construction, engineering, electronics, and financial company networks.) using the following: Flagpro(Flagpro is a Windows-based, first-stage downloader that has been used by BlackTech since at least October 2020. It has primarily been used against defense, media, and communications companies in Japan.), TSCookie(TSCookie is a remote access tool (RAT) that has been used by BlackTech in campaigns against Japanese targets.. TSCookie has been referred to as PLEAD though more recent reporting indicates a separation between the two.), BendyBear(BendyBear is an x64 shellcode for a stage-zero implant designed to download malware from a C2 server. First discovered in August 2020, BendyBear shares a variety of features with Waterbear, malware previously attributed to the Chinese cyber espionage group BlackTech.), Kivars(Kivars is a modular remote access tool (RAT), derived from the Bifrost RAT, that was used by BlackTech in a 2010 campaign.), PLEAD(PLEAD is a remote access tool (RAT) and downloader used by BlackTech in targeted attacks in East Asia including Taiwan, Japan, and Hong Kong. PLEAD has also been referred to as TSCookie, though more recent reporting indicates likely separation between the two. PLEAD was observed in use as early as March 2017.), Waterbear(Waterbear is modular malware attributed to BlackTech that has been used primarily for lateral movement, decrypting, and triggering payloads and is capable of hiding network behaviors.)"
G0097,Bouncing Golf(Bouncing Golf is a cyberespionage campaign targeting Middle Eastern countries.) using the following: GolfSpy(GolfSpy is Android spyware deployed by the group Bouncing Golf.)
G0060,"BRONZE BUTLER(BRONZE BUTLER is a cyber espionage group with likely Chinese origins that has been active since at least 2008. The group primarily targets Japanese organizations, particularly those in government, biotechnology, electronics manufacturing, and industrial chemistry.) using the following: build_downer(build_downer is a downloader that has been used by BRONZE BUTLER since at least 2019.), BBK(BBK is a downloader that has been used by BRONZE BUTLER since at least 2019.), ABK(ABK is a downloader that has been used by BRONZE BUTLER since at least 2019.), Avenger(Avenger is a downloader that has been used by BRONZE BUTLER since at least 2019.), down_new(down_new is a downloader that has been used by BRONZE BUTLER since at least 2019.)"
G0008,"Carbanak(Carbanak is a cybercriminal group that has used Carbanak malware to target financial institutions since at least 2013. Carbanak may be linked to groups tracked separately as Cobalt Group and FIN7 that have also used Carbanak malware.) using the following: Carberp(Carberp is a credential and information stealing malware that has been active since at least 2009. Carberp's source code was leaked online in 2013, and subsequently used as the foundation for the Carbanak backdoor.), Carbanak(Carbanak is a full-featured, remote backdoor used by a group of the same name (Carbanak). It is intended for espionage, data exfiltration, and providing remote access to infected machines.), Lizar(Lizar is a modular remote access tool written using the .NET Framework that shares structural similarities to Carbanak. It has likely been used by FIN7 since at least February 2021.)"
G0003,Cleaver(Cleaver is a threat group that has been attributed to Iranian actors and is responsible for activity tracked as Operation Cleaver.  Strong circumstantial evidence suggests Cleaver is linked to Threat Group 2889 (TG-2889).) using the following: TinyZBot(TinyZBot is a bot written in C# that was developed by Cleaver.)
G0080,"Cobalt Group(Cobalt Group is a financially motivated threat group that has primarily targeted financial institutions since at least 2016. The group has conducted intrusions to steal money via targeting ATM systems, card processing, payment systems and SWIFT systems. Cobalt Group has mainly targeted banks in Eastern Europe, Central Asia, and Southeast Asia. One of the alleged leaders was arrested in Spain in early 2018, but the group still appears to be active. The group has been known to target organizations in order to use their access to then compromise additional victims. Reporting indicates there may be links between Cobalt Group and both the malware Carbanak and the group Carbanak.) using the following: More_eggs(More_eggs is a JScript backdoor used by Cobalt Group and FIN6. Its name was given based on the variable ""More_eggs"" being present in its code. There are at least two different versions of the backdoor being used, version 2.0 and version 4.4.), SpicyOmelette(SpicyOmelette is a JavaScript based remote access tool that has been used by Cobalt Group since at least 2018.)"
G0052,"CopyKittens(CopyKittens is an Iranian cyber espionage group that has been operating since at least 2013. It has targeted countries including Israel, Saudi Arabia, Turkey, the U.S., Jordan, and Germany. The group is responsible for the campaign known as Operation Wilted Tulip.) using the following: Matryoshka(Matryoshka is a malware framework used by CopyKittens that consists of a dropper, loader, and RAT. It has multiple versions; v1 was seen in the wild from July 2016 until January 2017. v2 has fewer commands and other minor differences.), TDTESS(TDTESS is a 64-bit .NET binary backdoor used by CopyKittens.)"
G0070,"Dark Caracal(Dark Caracal is threat group that has been attributed to the Lebanese General Directorate of General Security (GDGS) and has operated since at least 2012.) using the following: Pallas(Pallas is mobile surveillanceware that was custom-developed by Dark Caracal.), Bandook(Bandook is a commercially available RAT, written in Delphi and C++, that has been available since at least 2007. It has been used against government, financial, energy, healthcare, education, IT, and legal organizations in the US, South America, Europe, and Southeast Asia. Bandook has been used by Dark Caracal, as well as in a separate campaign referred to as ""Operation Manul"".)"
G0012,"Darkhotel(Darkhotel is a suspected South Korean threat group that has targeted victims primarily in East Asia since at least 2004. The group's name is based on cyber espionage operations conducted via hotel Internet networks against traveling executives and other select guests. Darkhotel has also conducted spearphishing campaigns and infected victims through peer-to-peer and file sharing networks.) using the following: Ramsay(Ramsay is an information stealing malware framework designed to collect and exfiltrate sensitive documents, including from air-gapped systems. Researchers have identified overlaps between Ramsay and the Darkhotel-associated Retro malware.)"
G0079,DarkHydrus(DarkHydrus is a threat group that has targeted government agencies and educational institutions in the Middle East since at least 2016. The group heavily leverages open-source tools and custom payloads for carrying out attacks.) using the following: RogueRobin(RogueRobin is a payload used by DarkHydrus that has been developed in PowerShell and C#.)
G0009,"Deep Panda(Deep Panda is a suspected Chinese threat group known to target many industries, including government, defense, financial, and telecommunications.  The intrusion into healthcare company Anthem has been attributed to Deep Panda.  This group is also known as Shell Crew, WebMasters, KungFu Kittens, and PinkPanther.  Deep Panda also appears to be known as Black Vine based on the attribution of both group names to the Anthem intrusion.  Some analysts track Deep Panda and APT19 as the same group, but it is unclear from open source information if the groups are the same.) using the following: Mivast(Mivast is a backdoor that has been used by Deep Panda. It was reportedly used in the Anthem breach.), StreamEx(StreamEx is a malware family that has been used by Deep Panda since at least 2015. In 2016, it was distributed via legitimate compromised Korean websites.)"
G0035,"Dragonfly(Dragonfly is a cyber espionage group that has been attributed to Russia's Federal Security Service (FSB) Center 16. Active since at least 2010, Dragonfly has targeted defense and aviation companies, government entities, companies related to industrial control systems, and critical infrastructure sectors worldwide through supply chain, spearphishing, and drive-by compromise attacks.) using the following: MCMD(MCMD is a remote access tool that provides remote command shell capability used by Dragonfly 2.0.), Backdoor.Oldrea(Backdoor.Oldrea is a modular backdoor that used by Dragonfly against energy companies since at least 2013. Backdoor.Oldrea was distributed via supply chain compromise, and included specialized modules to enumerate and map ICS-specific systems, processes, and protocols.), Trojan.Karagany(Trojan.Karagany is a modular remote access tool used for recon and linked to Dragonfly. The source code for Trojan.Karagany originated from Dream Loader malware which was leaked in 2010 and sold on underground forums.)"
G0066,"Elderwood(Elderwood is a suspected Chinese cyber espionage group that was reportedly responsible for the 2009 Google intrusion known as Operation Aurora.  The group has targeted defense organizations, supply chain manufacturers, human rights and nongovernmental organizations (NGOs), and IT service providers.) using the following: Briba(Briba is a trojan used by Elderwood to open a backdoor and download files on to compromised hosts.), Pasam(Pasam is a trojan used by Elderwood to open a backdoor on compromised hosts.), Naid(Naid is a trojan used by Elderwood to open a backdoor on compromised hosts.), Hydraq(Hydraq is a data-theft trojan first used by Elderwood in the 2009 Google intrusion known as Operation Aurora, though variations of this trojan have been used in more recent campaigns by other Chinese actors, possibly including APT17.), Wiarp(Wiarp is a trojan used by Elderwood to open a backdoor on compromised hosts.), Nerex(Nerex is a Trojan used by Elderwood to open a backdoor on compromised hosts.), Linfo(Linfo is a rootkit trojan used by Elderwood to open a backdoor on compromised hosts.), Vasport(Vasport is a trojan used by Elderwood to open a backdoor on compromised hosts.)"
G1003,"Ember Bear(Ember Bear is a suspected Russian state-sponsored cyber espionage group that has been active since at least March 2021. Ember Bear has primarily focused their operations against Ukraine and Georgia, but has also targeted Western European and North American foreign ministries, pharmaceutical companies, and financial sector organizations. Security researchers assess Ember Bear likely conducted the WhisperGate destructive wiper attacks against Ukraine in early 2022.) using the following: OutSteel(OutSteel is a file uploader and document stealer developed with the scripting language AutoIT that has been used by Ember Bear since at least March 2021.), Saint Bot(Saint Bot is a .NET downloader that has been used by Ember Bear since at least March 2021.)"
G0120,Evilnum(Evilnum is a financially motivated threat group that has been active since at least 2018.) using the following: EVILNUM(EVILNUM is fully capable backdoor that was first identified in 2018. EVILNUM is used by the APT group Evilnum which has the same name.)
G0137,Ferocious Kitten(Ferocious Kitten is a threat group that has primarily targeted Persian-speaking individuals in Iran since at least 2015.) using the following: MarkiRAT(MarkiRAT is a remote access Trojan (RAT) compiled with Visual Studio that has been used by Ferocious Kitten since at least 2015.)
G0053,"FIN5(FIN5 is a financially motivated threat group that has targeted personally identifiable information and payment card information. The group has been active since at least 2008 and has targeted the restaurant, gaming, and hotel industries. The group is made up of actors who likely speak Russian.) using the following: FLIPSIDE(FLIPSIDE is a simple tool similar to Plink that is used by FIN5 to maintain access to victims.)"
G0037,"FIN6(FIN6 is a cyber crime group that has stolen payment card data and sold it for profit on underground marketplaces. This group has aggressively targeted and compromised point of sale (PoS) systems in the hospitality and retail sectors.) using the following: More_eggs(More_eggs is a JScript backdoor used by Cobalt Group and FIN6. Its name was given based on the variable ""More_eggs"" being present in its code. There are at least two different versions of the backdoor being used, version 2.0 and version 4.4.), GrimAgent(GrimAgent is a backdoor that has been used before the deployment of Ryuk ransomware since at least 2020; it is likely used by FIN6 and Wizard Spider.), FrameworkPOS(FrameworkPOS is a point of sale (POS) malware used by FIN6 to steal payment card data from sytems that run physical POS devices.)"
G0046,"FIN7(FIN7 is a financially-motivated threat group that has been active since 2013 primarily targeting the U.S. retail, restaurant, and hospitality sectors, often using point-of-sale malware. A portion of FIN7 was run out of a front company called Combi Security. Since 2020 FIN7 shifted operations to a big game hunting (BGH) approach including use of REvil ransomware and their own Ransomware as a Service (RaaS), Darkside. FIN7 may be linked to the Carbanak Group, but there appears to be several groups using Carbanak malware and are therefore tracked separately.) using the following: Lizar(Lizar is a modular remote access tool written using the .NET Framework that shares structural similarities to Carbanak. It has likely been used by FIN7 since at least February 2021.), Pillowmint(Pillowmint is a point-of-sale malware used by FIN7 designed to capture credit card information.), JSS Loader(JSS Loader is Remote Access Trojan (RAT) with .NET and C++ variants that has been used by FIN7 since at least 2020.), GRIFFON(GRIFFON is a JavaScript backdoor used by FIN7.), BOOSTWRITE(BOOSTWRITE is a loader crafted to be launched via abuse of the DLL search order of applications used by FIN7.), SQLRat(SQLRat is malware that executes SQL scripts to avoid leaving traditional host artifacts. FIN7 has been observed using it.)"
G0061,"FIN8(FIN8 is a financially motivated threat group known to launch tailored spearphishing campaigns targeting the retail, restaurant, and hospitality industries.) using the following: PUNCHTRACK(PUNCHTRACK is non-persistent point of sale (POS) system malware utilized by FIN8 to scrape payment card data.), PUNCHBUGGY(PUNCHBUGGY is a backdoor malware used by FIN8 that has been observed targeting POS networks in the hospitality industry.)"
G0117,"Fox Kitten(Fox Kitten is threat actor with a suspected nexus to the Iranian government that has been active since at least 2017 against entities in the Middle East, North Africa, Europe, Australia, and North America. Fox Kitten has targeted multiple industrial verticals including oil and gas, technology, government, defense, healthcare, manufacturing, and engineering.) using the following: Pay2Key(Pay2Key is a ransomware written in C++ that has been used by Fox Kitten since at least July 2020 including campaigns against Israeli companies. Pay2Key has been incorporated with a leak site to display stolen sensitive information to further pressure victims into payment.)"
G0093,"GALLIUM(GALLIUM is a cyberespionage group that has been active since at least 2012, primarily targeting telecommunications companies, financial institutions, and government entities in Afghanistan, Australia, Belgium, Cambodia, Malaysia, Mozambique, the Philippines, Russia, and Vietnam. Security researchers have identified GALLIUM as a likely Chinese state-sponsored group, based in part on tools used and TTPs commonly associated with Chinese threat actors.) using the following: PingPull(PingPull is a remote access Trojan (RAT) written in Visual C++ that has been used by GALLIUM since at least June 2022. PingPull has been used to target telecommunications companies, financial institutions, and government entities in Afghanistan, Australia, Belgium, Cambodia, Malaysia, Mozambique, the Philippines, Russia, and Vietnam.), BlackMould(BlackMould is a web shell based on China Chopper for servers running Microsoft IIS. First reported in December 2019, it has been used in malicious campaigns by GALLIUM against telecommunication providers.)"
G0047,"Gamaredon Group(Gamaredon Group is a suspected Russian cyber espionage threat group that has targeted military, NGO, judiciary, law enforcement, and non-profit organizations in Ukraine since at least 2013. The name Gamaredon Group comes from a misspelling of the word ""Armageddon"", which was detected in the adversary's early campaigns.In November 2021, the Ukrainian government publicly attributed Gamaredon Group to Russia's Federal Security Service (FSB) Center 18.) using the following: Pteranodon(Pteranodon is a custom backdoor used by Gamaredon Group.), PowerPunch(PowerPunch is a lightweight downloader that has been used by Gamaredon Group since at least 2021.), InvisiMole(InvisiMole is a modular spyware program that has been used by the InvisiMole Group since at least 2013. InvisiMole has two backdoor modules called RC2FM and RC2CL that are used to perform post-exploitation activities. It has been discovered on compromised victims in the Ukraine and Russia. Gamaredon Group infrastructure has been used to download and execute InvisiMole against a small number of victims.), QuietSieve(QuietSieve is an information stealer that has been used by Gamaredon Group since at least 2021.)"
