id,text_to_embed
G0055,"NEODYMIUM(NEODYMIUM is an activity group that conducted a campaign in May 2016 and has heavily targeted Turkish victims. The group has demonstrated similarity to another activity group called PROMETHIUM due to overlapping victim and campaign characteristics.   NEODYMIUM is reportedly associated closely with BlackOasis operations, but evidence that the group names are aliases has not been identified.) using the following: Wingbird(Wingbird is a backdoor that appears to be a version of commercial software FinFisher. It is reportedly used to attack individual computers instead of networks. It was used by NEODYMIUM in a May 2016 campaign.)"
G0133,"Nomadic Octopus(Nomadic Octopus is a Russian-speaking cyber espionage threat group that has primarily targeted Central Asia, including local governments, diplomatic missions, and individuals, since at least 2014. Nomadic Octopus has been observed conducting campaigns involving Android and Windows malware, mainly using the Delphi programming language, and building custom variants.) using the following: Octopus(Octopus is a Windows Trojan written in the Delphi programming language that has been used by Nomadic Octopus to target government organizations in Central Asia since at least 2014.)"
G0049,"OilRig(OilRig is a suspected Iranian threat group that has targeted Middle Eastern and international victims since at least 2014. The group has targeted a variety of sectors, including financial, government, energy, chemical, and telecommunications. It appears the group carries out supply chain attacks, leveraging the trust relationship between organizations to attack their primary targets. FireEye assesses that the group works on behalf of the Iranian government based on infrastructure details that contain references to Iran, use of Iranian infrastructure, and targeting that aligns with nation-state interests.) using the following: OopsIE(OopsIE is a Trojan used by OilRig to remotely execute commands as well as upload/download files to/from victims.), ISMInjector(ISMInjector is a Trojan used to install another OilRig backdoor, ISMAgent.), QUADAGENT(QUADAGENT is a PowerShell backdoor used by OilRig.), SideTwist(SideTwist is a C-based backdoor that has been used by OilRig since at least 2021.), SEASHARPEE(SEASHARPEE is a Web shell that has been used by OilRig.), BONDUPDATER(BONDUPDATER is a PowerShell backdoor used by OilRig. It was first observed in November 2017 during targeting of a Middle Eastern government organization, and an updated version was observed in August 2018 being used to target a government organization with spearphishing emails.), RDAT(RDAT is a backdoor used by the suspected Iranian threat group OilRig. RDAT was originally identified in 2017 and targeted companies in the telecommunications sector.)"
G0071,"Orangeworm(Orangeworm is a group that has targeted organizations in the healthcare sector in the United States, Europe, and Asia since at least 2015, likely for the purpose of corporate espionage.) using the following: Kwampirs(Kwampirs is a backdoor Trojan used by Orangeworm. It has been found on machines which had software installed for the use and control of high-tech imaging devices such as X-Ray and MRI machines.)"
G0040,"Patchwork(Patchwork is a cyber espionage group that was first observed in December 2015. While the group has not been definitively attributed, circumstantial evidence suggests the group may be a pro-Indian or Indian entity. Patchwork has been seen targeting industries related to diplomatic and government agencies. Much of the code used by this group was copied and pasted from online forums. Patchwork was also seen operating spearphishing campaigns targeting U.S. think tank groups in March and April of 2018.) using the following: BackConfig(BackConfig is a custom Trojan with a flexible plugin architecture that has been used by Patchwork.), NDiskMonitor(NDiskMonitor is a custom backdoor written in .NET that appears to be unique to Patchwork.), BADNEWS(BADNEWS is malware that has been used by the actors responsible for the Patchwork campaign. Its name was given due to its use of RSS feeds, forums, and blogs for command and control.)"
G0011,"PittyTiger(PittyTiger is a threat group believed to operate out of China that uses multiple different types of malware to maintain command and control.) using the following: Lurid(Lurid is a malware family that has been used by several groups, including PittyTiger, in targeted attacks as far back as 2006.)"
G0068,"PLATINUM(PLATINUM is an activity group that has targeted victims since at least 2009. The group has focused on targets associated with governments and related organizations in South and Southeast Asia.) using the following: JPIN(JPIN is a custom-built backdoor family used by PLATINUM. Evidence suggests developers of JPIN and Dipsind code bases were related in some way.), adbupd(adbupd is a backdoor used by PLATINUM that is similar to Dipsind.), Dipsind(Dipsind is a malware family of backdoors that appear to be used exclusively by PLATINUM.)"
G1005,"POLONIUM(POLONIUM is a Lebanon-based group that has primarily targeted Israeli organizations, including critical manufacturing, information technology, and defense industry companies, since at least February 2022. Security researchers assess POLONIUM has coordinated their operations with multiple actors affiliated with Iran’s Ministry of Intelligence and Security (MOIS), based on victim overlap as well as common techniques and tooling.) using the following: CreepySnail(CreepySnail is a custom PowerShell implant that has been used by POLONIUM since at least 2022.), CreepyDrive(CreepyDrive is a custom implant has been used by POLONIUM since at least early 2022 for C2 with and exfiltration to actor-controlled OneDrive accounts.POLONIUM has used a similar implant called CreepyBox that relies on actor-controlled DropBox accounts.)"
G0056,"PROMETHIUM(PROMETHIUM is an activity group focused on espionage that has been active since at least 2012. The group has conducted operations globally with a heavy emphasis on Turkish targets. PROMETHIUM has demonstrated similarity to another activity group called NEODYMIUM due to overlapping victim and campaign characteristics.) using the following: StrongPity(StrongPity is an information stealing malware used by PROMETHIUM.), Truvasys(Truvasys is first-stage malware that has been used by PROMETHIUM. It is a collection of modules written in the Delphi programming language.)"
G0024,"Putter Panda(Putter Panda is a Chinese threat group that has been attributed to Unit 61486 of the 12th Bureau of the PLA’s 3rd General Staff Department (GSD).) using the following: 4H RAT(4H RAT is malware that has been used by Putter Panda since at least 2007.), 3PARA RAT(3PARA RAT is a remote access tool (RAT) programmed in C++ that has been used by Putter Panda.), httpclient(httpclient is malware used by Putter Panda. It is a simple tool that provides a limited range of functionality, suggesting it is likely used as a second-stage or supplementary/backup tool.), pngdowner(pngdowner is malware used by Putter Panda. It is a simple tool with limited functionality and no persistence mechanism, suggesting it is used only as a simple ""download-and-execute"" utility.)"
G0075,"Rancor(Rancor is a threat group that has led targeted campaigns against the South East Asia region. Rancor uses politically-motivated lures to entice victims to open malicious documents.) using the following: PLAINTEE(PLAINTEE is a malware sample that has been used by Rancor in targeted attacks in Singapore and Cambodia.), DDKONG(DDKONG is a malware sample that was part of a campaign by Rancor. DDKONG was first seen used in February 2017.)"
G0048,"RTM(RTM is a cybercriminal group that has been active since at least 2015 and is primarily interested in users of remote banking systems in Russia and neighboring countries. The group uses a Trojan by the same name (RTM).) using the following: RTM(RTM is custom malware written in Delphi. It is used by the group of the same name (RTM). Newer versions of the malware have been reported publicly as Redaman.), Bankshot(Bankshot is a remote access tool (RAT) that was first reported by the Department of Homeland Security in December of 2017. In 2018, Lazarus Group used the Bankshot implant in attacks against the Turkish financial sector.), GoldenSpy(GoldenSpy is a backdoor malware which has been packaged with legitimate tax preparation software. GoldenSpy was discovered targeting organizations in China, being delivered with the ""Intelligent Tax"" software suite which is produced by the Golden Tax Department of Aisino Credit Information Co. and required to pay local taxes.)"
G0034,"Sandworm Team(Sandworm Team is a destructive threat group that has been attributed to Russia's General Staff Main Intelligence Directorate (GRU) Main Center for Special Technologies (GTsST) military unit 74455. This group has been active since at least 2009.In October 2020, the US indicted six GRU Unit 74455 officers associated with Sandworm Team for the following cyber operations: the 2015 and 2016 attacks against Ukrainian electrical companies and government organizations, the 2017 worldwide NotPetya attack, targeting of the 2017 French presidential campaign, the 2018 Olympic Destroyer attack against the Winter Olympic Games, the 2018 operation against the Organisation for the Prohibition of Chemical Weapons, and attacks against the country of Georgia in 2018 and 2019. Some of these were conducted with the assistance of GRU Unit 26165, which is also referred to as APT28.) using the following: 2016 Ukraine Electric Power Attack(2016 Ukraine Electric Power Attack was a Sandworm Team campaign during which they used Industroyer malware to target and disrupt distribution substations within the Ukrainian power grid. This campaign was the second major public attack conducted against Ukraine by Sandworm Team.), CHEMISTGAMES(CHEMISTGAMES is a modular backdoor that has been deployed by Sandworm Team.), Cyclops Blink(Cyclops Blink is a modular malware that has been used in widespread campaigns by Sandworm Team since at least 2019 to target Small/Home Office (SOHO) network devices, including WatchGuard and Asus.), Olympic Destroyer(Olympic Destroyer is malware that was used by Sandworm Team against the 2018 Winter Olympics, held in Pyeongchang, South Korea. The main purpose of the malware was to render infected computer systems inoperable. The malware leverages various native Windows utilities and API calls to carry out its destructive tasks. Olympic Destroyer has worm-like features to spread itself across a computer network in order to maximize its destructive impact.), NotPetya(NotPetya is malware that was used by Sandworm Team in a worldwide attack starting on June 27, 2017. While NotPetya appears as a form of ransomware, its main purpose was to destroy data and disk structures on compromised systems; the attackers never intended to make the encrypted data recoverable. As such, NotPetya may be more appropriately thought of as a form of wiper malware. NotPetya contains worm-like features to spread itself across a computer network using the SMBv1 exploits EternalBlue and EternalRomance.), Prestige(Prestige ransomware has been used by Sandworm Team since at least March 2022, including against transportation and related logistics industries in Ukraine and Poland in October 2022.)"
G0029,"Scarlet Mimic(Scarlet Mimic is a threat group that has targeted minority rights activists. This group has not been directly linked to a government source, but the group's motivations appear to overlap with those of the Chinese government. While there is some overlap between IP addresses used by Scarlet Mimic and Putter Panda, it has not been concluded that the groups are the same.) using the following: MobileOrder(MobileOrder is a Trojan intended to compromise Android mobile devices. It has been used by Scarlet Mimic.), Psylo(Psylo is a shellcode-based Trojan that has been used by Scarlet Mimic. It has similar characteristics as FakeM.), FakeM(FakeM is a shellcode-based Windows backdoor that has been used by Scarlet Mimic.)"
G1008,"SideCopy(SideCopy is a Pakistani threat group that has primarily targeted South Asian countries, including Indian and Afghani government personnel, since at least 2019. SideCopy's name comes from its infection chain that tries to mimic that of Sidewinder, a suspected Indian threat group.) using the following: AuTo Stealer(AuTo Stealer is malware written in C++ has been used by SideCopy since at least December 2021 to target government agencies and personnel in India and Afghanistan.), Action RAT(Action RAT is a  remote access tool written in Delphi that has been used by SideCopy since at least December 2021 against Indian and Afghani government personnel.)"
G0054,"Sowbug(Sowbug is a threat group that has conducted targeted attacks against organizations in South America and Southeast Asia, particularly government entities, since at least 2015.) using the following: Felismus(Felismus is a modular backdoor that has been used by Sowbug.)"
G0041,"Strider(Strider is a threat group that has been active since at least 2011 and has targeted victims in Russia, China, Sweden, Belgium, Iran, and Rwanda.) using the following: Remsec(Remsec is a modular backdoor that has been used by Strider and appears to have been designed primarily for espionage purposes. Many of its modules are written in Lua.)"
G0039,Suckfly(Suckfly is a China-based threat group that has been active since at least 2014.) using the following: Nidiran(Nidiran is a custom backdoor developed and used by Suckfly. It has been delivered via strategic web compromise.)
G0062,"TA459(TA459 is a threat group believed to operate out of China that has targeted countries including Russia, Belarus, Mongolia, and others.) using the following: ZeroT(ZeroT is a Trojan used by TA459, often in conjunction with PlugX.)"
G0092,"TA505(TA505 is a cyber criminal group that has been active since at least 2014. TA505 is known for frequently changing malware, driving global trends in criminal malware distribution, and ransomware campaigns involving Clop.) using the following: Get2(Get2 is a downloader written in C++ that has been used by TA505 to deliver FlawedGrace, FlawedAmmyy, Snatch and SDBbot.), SDBbot(SDBbot is a backdoor with installer and loader components that has been used by TA505 since at least 2019.)"
G0127,"TA551(TA551 is a financially-motivated threat group that has been active since at least 2018.  The group has primarily targeted English, German, Italian, and Japanese speakers through email-based malware distribution campaigns.) using the following: SVCReady(SVCReady is a loader that has been used since at least April 2022 in malicious spam campaigns. Security researchers have noted overlaps between TA551 activity and SVCReady distribution, including similarities in file names, lure images, and identical grammatical errors.)"
G0139,TeamTNT(TeamTNT is a threat group that has primarily targeted cloud and containerized environments. The group as been active since at least October 2019 and has mainly focused its efforts on leveraging cloud and container resources to deploy cryptocurrency miners in victim environments.) using the following: Hildegard(Hildegard is malware that targets misconfigured kubelets for initial access and runs cryptocurrency miner operations. The malware was first observed in January 2021. The TeamTNT activity group is believed to be behind Hildegard.)
G0027,"Threat Group-3390(Threat Group-3390 is a Chinese threat group that has extensively used strategic Web compromises to target victims. The group has been active since at least 2010 and has targeted organizations in the aerospace, government, defense, technology, energy, manufacturing and gambling/betting sectors.) using the following: Pandora(Pandora is a multistage kernel rootkit with backdoor functionality that has been in use by Threat Group-3390 since at least 2020.), SysUpdate(SysUpdate is a backdoor written in C++ that has been used by Threat Group-3390 since at least 2020.), HyperBro(HyperBro is a custom in-memory backdoor used by Threat Group-3390.), Clambling(Clambling is a modular backdoor written in C++ that has been used by Threat Group-3390 since at least 2017.), ASPXSpy(ASPXSpy is a Web shell. It has been modified by Threat Group-3390 actors to create the ASPXTool version.), RCSession(RCSession is a backdoor written in C++ that has been in use since at least 2018 by Mustang Panda and by Threat Group-3390 (Type II Backdoor).), OwaAuth(OwaAuth is a Web shell and credential stealer deployed to Microsoft Exchange servers that appears to be exclusively used by Threat Group-3390.)"
G0131,"Tonto Team(Tonto Team is a suspected Chinese state-sponsored cyber espionage threat group that has primarily targeted South Korea, Japan, Taiwan, and the United States since at least 2009; by 2020 they expanded operations to include other Asian as well as Eastern European countries. Tonto Team has targeted government, military, energy, mining, financial, education, healthcare, and technology organizations, including through the Heartbeat Campaign (2009-2012) and Operation Bitter Biscuit (2017).) using the following: Bisonal(Bisonal is a remote access tool (RAT) that has been used by Tonto Team against public and private sector organizations in Russia, South Korea, and Japan since at least December 2010.)"
G0134,"Transparent Tribe(Transparent Tribe is a suspected Pakistan-based threat group that has been active since at least 2013, primarily targeting diplomatic, defense, and research organizations in India and Afghanistan.) using the following: C0011(C0011 was a suspected cyber espionage campaign conducted by Transparent Tribe that targeted students at universities and colleges in India. Security researchers noted this campaign against students was a significant shift from Transparent Tribe's historic targeting Indian government, military, and think tank personnel, and assessed it was still ongoing as of July 2022.), Crimson(Crimson is a remote access Trojan that has been used by Transparent Tribe since at least 2016.), ObliqueRAT(ObliqueRAT is a remote access trojan, similar to Crimson, that has been in use by Transparent Tribe since at least 2020.)"
G0081,"Tropic Trooper(Tropic Trooper is an unaffiliated threat group that has led targeted campaigns against targets in Taiwan, the Philippines, and Hong Kong. Tropic Trooper focuses on targeting government, healthcare, transportation, and high-tech industries and has been active since 2011.) using the following: YAHOYAH(YAHOYAH is a Trojan used by Tropic Trooper as a second-stage backdoor.), USBferry(USBferry is an information stealing malware and has been used by Tropic Trooper in targeted attacks against Taiwanese and Philippine air-gapped military environments. USBferry shares an overlapping codebase with YAHOYAH, though it has several features which makes it a distinct piece of malware.)"
G0010,"Turla(Turla is a Russian-based threat group that has infected victims in over 45 countries, spanning a range of industries including government, embassies, military, education, research and pharmaceutical companies since 2004. Heightened activity was seen in mid-2015. Turla is known for conducting watering hole and spearphishing campaigns and leveraging in-house tools and malware. Turla’s espionage platform is mainly used against Windows machines, but has also been seen used against macOS and Linux machines.) using the following: IronNetInjector(IronNetInjector is a Turla toolchain that utilizes scripts from the open-source IronPython implementation of Python with a .NET injector to drop one or more payloads including ComRAT.), TinyTurla(TinyTurla is a backdoor that has been used by Turla against targets in the US, Germany, and Afghanistan since at least 2020.), ComRAT(ComRAT is a second stage implant suspected of being a descendant of Agent.btz and used by Turla. The first version of ComRAT was identified in 2007, but the tool has undergone substantial development for many years since.), Crutch(Crutch is a backdoor designed for document theft that has been used by Turla since at least 2015.), Carbon(Carbon is a sophisticated, second-stage backdoor and framework that can be used to steal sensitive information from victims. Carbon has been selectively used by Turla to target government and foreign affairs-related organizations in Central Asia.), Epic(Epic is a backdoor that has been used by Turla.), Gazer(Gazer is a backdoor used by Turla since at least 2016.), LightNeuron(LightNeuron is a sophisticated backdoor that has targeted Microsoft Exchange servers since at least 2014. LightNeuron has been used by Turla to target diplomatic and foreign affairs-related organizations. The presence of certain strings in the malware suggests a Linux variant of LightNeuron exists.), HyperStack(HyperStack is a RPC-based backdoor used by Turla since at least 2018. HyperStack has similarities to other backdoors used by Turla including Carbon.), Mosquito(Mosquito is a Win32 backdoor that has been used by Turla. Mosquito is made up of three parts: the installer, the launcher, and the backdoor. The main backdoor is called CommanderDLL and is launched by the loader program.), PowerStallion(PowerStallion is a lightweight PowerShell backdoor used by Turla, possibly as a recovery access tool to install other backdoors.), Uroburos(Uroburos is a rootkit used by Turla.), Penquin(Penquin is a remote access trojan (RAT) with multiple versions used by Turla to target Linux systems since at least 2014.)"
G0123,"Volatile Cedar(Volatile Cedar is a Lebanese threat group that has targeted individuals, companies, and institutions worldwide. Volatile Cedar has been operating since 2012 and is motivated by political and ideological interests.) using the following: Caterpillar WebShell(Caterpillar WebShell is a self-developed Web Shell tool created by the group Volatile Cedar.), Explosive(Explosive is a custom-made remote access tool used by the group Volatile Cedar. It was first identified in the wild in 2015.)"
G0112,"Windshift(Windshift is a threat group that has been active since at least 2017, targeting specific individuals for surveillance in government departments and critical infrastructure across the Middle East.) using the following: WindTail(WindTail is a macOS surveillance implant used by Windshift. WindTail shares code similarities with Hack Back aka KitM OSX.)"
G0044,"Winnti Group(Winnti Group is a threat group with Chinese origins that has been active since at least 2010. The group has heavily targeted the gaming industry, but it has also expanded the scope of its targeting. Some reporting suggests a number of other groups, including Axiom, APT17, and Ke3chang, are closely linked to Winnti Group.) using the following: Operation CuckooBees(Operation CuckooBees was a cyber espionage campaign targeting technology and manufacturing companies in East Asia, Western Europe, and North America since at least 2019. Security researchers noted the goal of Operation CuckooBees, which was still ongoing as of May 2022, was likely the theft of proprietary information, research and development documents, source code, and blueprints for various technologies. Researchers assessed Operation CuckooBees was conducted by actors affiliated with Winnti Group, APT41, and BARIUM.), Winnti for Linux(Winnti for Linux is a trojan, seen since at least 2015, designed specifically for targeting Linux systems. Reporting indicates the winnti malware family is shared across a number of actors including Winnti Group. The Windows variant is tracked separately under Winnti for Windows.), PipeMon(PipeMon is a multi-stage modular backdoor used by Winnti Group.), Winnti for Windows(Winnti for Windows is a modular remote access Trojan (RAT) that has been used likely by multiple groups to carry out intrusions in various regions since at least 2010, including by one group referred to as the same name, Winnti Group.. The Linux variant is tracked separately under Winnti for Linux.)"
G0090,"WIRTE(WIRTE is a threat group that has been active since at least August 2018. WIRTE has targeted government, diplomatic, financial, military, legal, and technology organizations in the Middle East and Europe.) using the following: Ferocious(Ferocious is a first stage implant composed of VBS and PowerShell scripts that has been used by WIRTE since at least 2021.), LitePower(LitePower is a downloader and second stage malware that has been used by WIRTE since at least 2021.)"
G0102,"Wizard Spider(Wizard Spider is a Russia-based financially motivated threat group originally known for the creation and deployment of TrickBot since at least 2016. Wizard Spider possesses a diverse arsenal of tools and has conducted ransomware campaigns against a variety of organizations, ranging from major corporations to hospitals.) using the following: GrimAgent(GrimAgent is a backdoor that has been used before the deployment of Ryuk ransomware since at least 2020; it is likely used by FIN6 and Wizard Spider.), Diavol(Diavol is a ransomware variant first observed in June 2021 that is capable of prioritizing file types to encrypt based on a pre-configured list of extensions defined by the attacker. Diavol has been deployed by Bazar and is thought to have potential ties to Wizard Spider.), TrickBot(TrickBot is a Trojan spyware program written in C++ that first emerged in September 2016 as a possible successor to Dyre. TrickBot was developed and initially used by Wizard Spider for targeting banking sites in North America, Australia, and throughout Europe; it has since been used against all sectors worldwide as part of ""big game hunting"" ransomware campaigns.)"
