id,text_to_embed
G0115,"GOLD SOUTHFIELD(GOLD SOUTHFIELD is a financially motivated threat group active since at least 2018 that operates the REvil Ransomware-as-a Service (RaaS). GOLD SOUTHFIELD provides backend infrastructure for affiliates recruited on underground forums to perpetrate high value deployments. By early 2020, GOLD SOUTHFIELD started capitalizing on the new trend of stealing data and further extorting the victim to pay for their data to not get publicly leaked.) using the following: REvil(REvil is a ransomware family that has been linked to the GOLD SOUTHFIELD group and operated as ransomware-as-a-service (RaaS) since at least April 2019. REvil, which as been used against organizations in the manufacturing, transportation, and electric sectors, is highly configurable and shares code similarities with the GandCrab RaaS.), ConnectWise(ConnectWise is a legitimate remote administration tool that has been used since at least 2016 by threat actors including MuddyWater and GOLD SOUTHFIELD to connect to and conduct lateral movement in target environments.)"
G0125,"HAFNIUM(HAFNIUM is a likely state-sponsored cyber espionage group operating out of China that has been active since at least January 2021. HAFNIUM primarily targets entities in the US across a number of industry sectors, including infectious disease researchers, law firms, higher education institutions, defense contractors, policy think tanks, and NGOs.) using the following: Tarrask(Tarrask is malware that has been used by HAFNIUM since at least August 2021. Tarrask was designed to evade digital defenses and maintain persistence by generating concealed scheduled tasks.)"
G1001,"HEXANE(HEXANE is a cyber espionage threat group that has targeted oil & gas, telecommunications, aviation, and internet service provider organizations since at least 2017. Targeted companies have been located in the Middle East and Africa, including Israel, Saudi Arabia, Kuwait, Morocco, and Tunisia. HEXANE's TTPs appear similar to APT33 and OilRig but due to differences in victims and tools it is tracked as a separate entity.) using the following: DanBot(DanBot is a first-stage remote access Trojan written in C# that has been used by HEXANE since at least 2018.), Milan(Milan is a backdoor implant based on DanBot that was written in Visual C++ and .NET. Milan has been used by HEXANE since at least June 2020.), Kevin(Kevin is a backdoor implant written in C++ that has been used by HEXANE since at least June 2020, including in operations against organizations in Tunisia.), Shark(Shark is a backdoor malware written in C# and .NET that is an updated version of Milan; it has been used by HEXANE since at least July 2021.), DnsSystem(DnsSystem is a .NET based DNS backdoor, which is a customized version of the open source tool DIG.net, that has been used by HEXANE since at least June 2022.)"
G0100,"Inception(Inception is a cyber espionage group active since at least 2014. The group has targeted multiple industries and governmental entities primarily in Russia, but has also been active in the United States and throughout Europe, Asia, Africa, and the Middle East.) using the following: PowerShower(PowerShower is a PowerShell backdoor used by Inception for initial reconnaissance and to download and execute second stage payloads.), VBShower(VBShower is a backdoor that has been used by Inception since at least 2019. VBShower has been used as a downloader for second stage payloads, including PowerShower.)"
G0136,"IndigoZebra(IndigoZebra is a suspected Chinese cyber espionage group that has been targeting Central Asian governments since at least 2014.) using the following: BoxCaon(BoxCaon is a Windows backdoor that was used by IndigoZebra in a 2021 spearphishing campaign against Afghan government officials. BoxCaon's name stems from similarities shared with the malware family xCaon.), xCaon(xCaon is an HTTP variant of the BoxCaon malware family that has used by IndigoZebra since at least 2014. xCaon has been used to target political entities in Central Asia, including Kyrgyzstan and Uzbekistan.)"
G0119,"Indrik Spider(Indrik Spider is a Russia-based cybercriminal group that has been active since at least 2014. Indrik Spider initially started with the Dridex banking Trojan, and then by 2017 they began running ransomware operations using BitPaymer, WastedLocker, and Hades ransomware.) using the following: WastedLocker(WastedLocker is a ransomware family attributed to Indrik Spider that has been used since at least May 2020. WastedLocker has been used against a broad variety of sectors, including manufacturing, information technology, and media.)"
G0004,"Ke3chang(Ke3chang is a threat group attributed to actors operating out of China. Ke3chang has targeted oil, government, diplomatic, military, and NGOs in Central and South America, the Caribbean, Europe, and North America since at least 2010.) using the following: Okrum(Okrum is a Windows backdoor that has been seen in use since December 2016 with strong links to Ke3chang.), BS2005(BS2005 is malware that was used by Ke3chang in spearphishing campaigns since at least 2011.), Neoichor(Neoichor is C2 malware used by Ke3chang since at least 2019; similar malware families used by the group include Leeson and Numbldea.)"
G0094,"Kimsuky(Kimsuky is a North Korea-based cyber espionage group that has been active since at least 2012. The group initially focused on targeting South Korean government entities, think tanks, and individuals identified as experts in various fields, and expanded its operations to include the United States, Russia, Europe, and the UN. Kimsuky has focused its intelligence collection activities on foreign policy and national security issues related to the Korean peninsula, nuclear policy, and sanctions.Kimsuky was assessed to be responsible for the 2014 Korea Hydro & Nuclear Power Co. compromise; other notable campaigns include Operation STOLEN PENCIL (2018), Operation Kabar Cobra (2019), and Operation Smoke Screen (2019).North Korean group definitions are known to have significant overlap, and some security researchers report all North Korean state-sponsored cyber activity under the name Lazarus Group instead of tracking clusters or subgroups.) using the following: CSPY Downloader(CSPY Downloader is a tool designed to evade analysis and download additional payloads used by Kimsuky.), KGH_SPY(KGH_SPY is a modular suite of tools used by Kimsuky for reconnaissance, information stealing, and backdoor capabilities. KGH_SPY derived its name from PDB paths and internal names found in samples containing ""KGH"".), AppleSeed(AppleSeed is a backdoor that has been used by Kimsuky to target South Korean government, academic, and commercial  targets since at least 2021.)"
G0032,"Lazarus Group(Lazarus Group is a North Korean state-sponsored cyber threat group that has been attributed to the Reconnaissance General Bureau. The group has been active since at least 2009 and was reportedly responsible for the November 2014 destructive wiper attack against Sony Pictures Entertainment as part of a campaign named Operation Blockbuster by Novetta. Malware used by Lazarus Group correlates to other reported campaigns, including Operation Flame, Operation 1Mission, Operation Troy, DarkSeoul, and Ten Days of Rain. North Korean group definitions are known to have significant overlap, and some security researchers report all North Korean state-sponsored cyber activity under the name Lazarus Group instead of tracking clusters or subgroups, such as Andariel, APT37, APT38, and Kimsuky.) using the following: ThreatNeedle(ThreatNeedle is a backdoor that has been used by Lazarus Group since at least 2019 to target cryptocurrency, defense, and mobile gaming organizations.  It is considered to be an advanced cluster of Lazarus Group's Manuscrypt (a.k.a. NukeSped) malware family.), TYPEFRAME(TYPEFRAME is a remote access tool that has been used by Lazarus Group.), DRATzarus(DRATzarus is a remote access tool (RAT) that has been used by Lazarus Group to target the defense and aerospace organizations globally since at least summer 2020. DRATzarus shares similarities with Bankshot, which was used by Lazarus Group in 2017 to target the Turkish financial sector.), TAINTEDSCRIBE(TAINTEDSCRIBE is a fully-featured beaconing implant integrated with command modules used by Lazarus Group. It was first reported in May 2020.), Torisma(Torisma is a second stage implant designed for specialized monitoring that has been used by Lazarus Group. Torisma was discovered during an investigation into the 2020 Operation North Star campaign that targeted the defense sector.), AppleJeus(AppleJeus is a family of downloaders initially discovered in 2018 embedded within trojanized cryptocurrency applications. AppleJeus has been used by Lazarus Group, targeting companies in the energy, finance, government, industry, technology, and telecommunications sectors, and several countries including the United States, United Kingdom, South Korea, Australia, Brazil, New Zealand, and Russia. AppleJeus has been used to distribute the FALLCHILL RAT.), Dacls(Dacls is a multi-platform remote access tool used by Lazarus Group since at least December 2019.), RATANKBA(RATANKBA is a remote controller tool used by Lazarus Group. RATANKBA has been used in attacks targeting financial institutions in Poland, Mexico, Uruguay, the United Kingdom, and Chile. It was also seen used against organizations related to telecommunications, management consulting, information technology, insurance, aviation, and education. RATANKBA has a graphical user interface to allow the attacker to issue jobs to perform on the infected machines.), Proxysvc(Proxysvc is a malicious DLL used by Lazarus Group in a campaign known as Operation GhostSecret. It has appeared to be operating undetected since 2017 and was mostly observed in higher education organizations. The goal of Proxysvc is to deliver additional payloads to the target and to maintain control for the attacker. It is in the form of a DLL that can also be executed as a standalone process.), AuditCred(AuditCred is a malicious DLL that has been used by Lazarus Group during their 2018 attacks.), Dtrack(Dtrack is spyware that was discovered in 2019 and has been used against Indian financial institutions, research facilities, and the Kudankulam Nuclear Power Plant. Dtrack shares similarities with the DarkSeoul campaign, which was attributed to Lazarus Group.), FALLCHILL(FALLCHILL is a RAT that has been used by Lazarus Group since at least 2016 to target the aerospace, telecommunications, and finance industries. It is usually dropped by other Lazarus Group malware or delivered when a victim unknowingly visits a compromised website.), BADCALL(BADCALL is a Trojan malware variant used by the group Lazarus Group.), Bankshot(Bankshot is a remote access tool (RAT) that was first reported by the Department of Homeland Security in December of 2017. In 2018, Lazarus Group used the Bankshot implant in attacks against the Turkish financial sector.), Cryptoistic(Cryptoistic is a backdoor, written in Swift, that has been used by Lazarus Group.), Rising Sun(Rising Sun is a modular backdoor that was used extensively in Operation Sharpshooter between 2017 and 2019. Rising Sun infected at least 87 organizations around the world, including nuclear, defense, energy, and financial service companies. Security researchers assessed Rising Sun included some source code from Lazarus Group's Trojan Duuzer.), Operation Sharpshooter(Operation Sharpshooter was a global cyber espionage campaign that targeted nuclear, defense, government, energy, and financial companies, with many located in Germany, Turkey, the United Kingdom, and the United States. Security researchers noted the campaign shared many similarities with previous Lazarus Group operations, including fake job recruitment lures and shared malware code.), Operation Dream Job(Operation Dream Job was a cyber espionage operation likely conducted by Lazarus Group that targeted the defense, aerospace, government, and other sectors in the United States, Israel, Australia, Russia, and India. In at least one case, the cyber actors tried to monetize their network access to conduct a business email compromise (BEC) operation. In 2020, security researchers noted overlapping TTPs, to include fake job lures and code similarities, between Operation Dream Job, Operation North Star, and Operation Interception; by 2022 security researchers described Operation Dream Job as an umbrella term covering both Operation Interception and Operation North Star.)"
G0140,"LazyScripter(LazyScripter is threat group that has mainly targeted the airlines industry since at least 2018, primarily using open-source toolsets.) using the following: KOCTOPUS(KOCTOPUS's batch variant is loader used by LazyScripter since 2018 to launch Octopus and Koadic and, in some cases, QuasarRAT. KOCTOPUS also has a VBA variant that has the same functionality as the batch version.)"
G0065,"Leviathan(Leviathan is a Chinese state-sponsored cyber espionage group that has been attributed to the Ministry of State Security's (MSS) Hainan State Security Department and an affiliated front company. Active since at least 2009, Leviathan has targeted the following sectors: academia, aerospace/aviation, biomedical, defense industrial base, government, healthcare, manufacturing, maritime, and transportation across the US, Canada, Europe, the Middle East, and Southeast Asia.) using the following: HOMEFRY(HOMEFRY is a 64-bit Windows password dumper/cracker that has previously been used in conjunction with other Leviathan backdoors.), BADFLICK(BADFLICK is a backdoor used by Leviathan in spearphishing campaigns first reported in 2018 that targeted the U.S. engineering and maritime industries.), MURKYTOP(MURKYTOP is a reconnaissance tool used by Leviathan.), NanHaiShu(NanHaiShu is a remote access tool and JScript backdoor used by Leviathan. NanHaiShu has been used to target government and private-sector organizations that have relations to the South China Sea dispute.), Orz(Orz is a custom JavaScript backdoor used by Leviathan. It was observed being used in 2014 as well as in August 2017 when it was dropped by Microsoft Publisher files.)"
G0030,"Lotus Blossom(Lotus Blossom is a threat group that has targeted government and military organizations in Southeast Asia.) using the following: Emissary(Emissary is a Trojan that has been used by Lotus Blossom. It shares code with Elise, with both Trojans being part of a malware group referred to as LStudio.), Elise(Elise is a custom backdoor Trojan that appears to be used exclusively by Lotus Blossom. It is part of a larger group oftools referred to as LStudio, ST Group, and APT0LSTU.)"
G0095,"Machete(Machete is a suspected Spanish-speaking cyber espionage group that has been active since at least 2010. It has primarily focused its operations within Latin America, with a particular emphasis on Venezuela, but also in the US, Europe, Russia, and parts of Asia. Machete generally targets high-profile organizations such as government institutions, intelligence services, and military units, as well as telecommunications and power companies.) using the following: Machete(Machete is a cyber espionage toolset used by Machete. It is a Python-based backdoor targeting Windows machines that was first observed in 2010.)"
G0059,"Magic Hound(Magic Hound is an Iranian-sponsored threat group that conducts long term, resource-intensive cyber espionage operations, likely on behalf of the Islamic Revolutionary Guard Corps. They have targeted European, U.S., and Middle Eastern government and military personnel, academics, journalists, and organizations such as the World Health Organization (WHO), via complex social engineering campaigns since at least 2014.) using the following: CharmPower(CharmPower is a PowerShell-based, modular backdoor that has been used by Magic Hound since at least 2022.), PowerLess(PowerLess is a PowerShell-based modular backdoor that has been used by Magic Hound since at least 2022.)"
G0045,"menuPass(menuPass is a threat group that has been active since at least 2006. Individual members of menuPass are known to have acted in association with the Chinese Ministry of State Security's (MSS) Tianjin State Security Bureau and worked for the Huaying Haitai Science and Technology Development Company.menuPass has targeted healthcare, defense, aerospace, finance, maritime, biotechnology, energy, and government sectors globally, with an emphasis on Japanese organizations. In 2016 and 2017, the group is known to have targeted managed IT service providers (MSPs), manufacturing and mining companies, and a university.) using the following: SNUGRIDE(SNUGRIDE is a backdoor that has been used by menuPass as first stage malware.), P8RAT(P8RAT is a fileless malware used by menuPass to download and execute payloads since at least 2020.), EvilGrab(EvilGrab is a malware family with common reconnaissance capabilities. It has been deployed by menuPass via malicious Microsoft Office documents as part of spearphishing campaigns.), Ecipekac(Ecipekac is a multi-layer loader that has been used by menuPass since at least 2019 including use as a loader for P8RAT, SodaMaster, and FYAnti.), RedLeaves(RedLeaves is a malware family used by menuPass. The code overlaps with PlugX and may be based upon the open source tool Trochilus.), ChChes(ChChes is a Trojan that appears to be used exclusively by menuPass. It was used to target Japanese organizations in 2016. Its lack of persistence methods suggests it may be intended as a first-stage tool.), SodaMaster(SodaMaster is a fileless malware used by menuPass to download and execute payloads since at least 2020.), UPPERCUT(UPPERCUT is a backdoor that has been used by menuPass.), FYAnti(FYAnti is a loader that has been used by menuPass since at least 2020, including to deploy QuasarRAT.)"
G1013,"Metador(Metador is a suspected cyber espionage group that was first reported in September 2022. Metador has targeted a limited number of telecommunication companies, internet service providers, and universities in the Middle East and Africa. Security researchers named the group Metador based on the ""I am meta"" string in one of the group's malware samples and the expectation of Spanish-language responses from C2 servers.) using the following: metaMain(metaMain is a backdoor used by Metador to maintain long-term access to compromised machines; it has also been used to decrypt Mafalda into memory.), Mafalda(Mafalda is a flexible interactive implant that has been used by Metador. Security researchers assess the Mafalda name may be inspired by an Argentinian cartoon character that has been popular as a means of political commentary since the 1960s.)"
G0103,"Mofang(Mofang is a likely China-based cyber espionage group, named for its frequent practice of imitating a victim's infrastructure. This adversary has been observed since at least May 2012 conducting focused attacks against government and critical infrastructure in Myanmar, as well as several other countries and sectors including military, automobile, and weapons industries.) using the following: ShimRat(ShimRat has been used by the suspected China-based adversary Mofang in campaigns targeting multiple countries and sectors including government, military, critical infrastructure, automobile, and weapons development. The name ""ShimRat"" comes from the malware's extensive use of Windows Application Shimming to maintain persistence.), ShimRatReporter(ShimRatReporter is a tool used by suspected Chinese adversary Mofang to automatically conduct initial discovery. The details from this discovery are used to customize follow-on payloads (such as ShimRat) as well as set up faux infrastructure which mimics the adversary's targets. ShimRatReporter has been used in campaigns targeting multiple countries and sectors including government, military, critical infrastructure, automobile, and weapons development.)"
G0021,"Molerats(Molerats is an Arabic-speaking, politically-motivated threat group that has been operating since 2012. The group's victims have primarily been in the Middle East, Europe, and the United States.) using the following: DustySky(DustySky is multi-stage malware written in .NET that has been used by Molerats since May 2015.)"
G1009,"Moses Staff(Moses Staff is a suspected Iranian threat group that has primarily targeted Israeli companies since at least September 2021. Moses Staff openly stated their motivation in attacking Israeli companies is to cause damage by leaking stolen sensitive data and encrypting the victim's networks without a ransom demand. Security researchers assess Moses Staff is politically motivated, and has targeted government, finance, travel, energy, manufacturing, and utility companies outside of Israel as well, including those in Italy, India, Germany, Chile, Turkey, the UAE, and the US.) using the following: StrifeWater(StrifeWater is a remote-access tool that has been used by Moses Staff in the initial stages of their attacks since at least November 2021.), PyDCrypt(PyDCrypt is malware written in Python designed to deliver DCSrv. It has been used by Moses Staff since at least September 2021, with each sample tailored for its intended victim organization.), DCSrv(DCSrv is destructive malware that has been used by Moses Staff since at least  September 2021. Though DCSrv has ransomware-like capabilities, Moses Staff does not demand ransom or offer a decryption key.)"
G0069,"MuddyWater(MuddyWater is a cyber espionage group assessed to be a subordinate element within Iran's Ministry of Intelligence and Security (MOIS). Since at least 2017, MuddyWater has targeted a range of government and private organizations across sectors, including telecommunications, local government, defense, and oil and natural gas organizations, in the Middle East, Asia, Africa, Europe, and North America.) using the following: SHARPSTATS(SHARPSTATS is a .NET backdoor used by MuddyWater since at least 2019.), RemoteUtilities(RemoteUtilities is a legitimate remote administration tool that has been used by MuddyWater since at least 2021 for execution on target machines.), Out1(Out1 is a remote access tool written in python and used by MuddyWater since at least 2021.), ConnectWise(ConnectWise is a legitimate remote administration tool that has been used since at least 2016 by threat actors including MuddyWater and GOLD SOUTHFIELD to connect to and conduct lateral movement in target environments.), Small Sieve(Small Sieve is a Telegram Bot API-based Python backdoor that has been distributed using a Nullsoft Scriptable Install System (NSIS) Installer; it has been used by MuddyWater since at least January 2022.Security researchers have also noted Small Sieve's use by UNC3313, which may be associated with MuddyWater.), PowGoop(PowGoop is a loader that consists of a DLL loader and a PowerShell-based downloader; it has been used by MuddyWater as their main loader.), Mori(Mori is a backdoor that has been used by MuddyWater since at least January 2022.), POWERSTATS(POWERSTATS is a PowerShell-based first stage backdoor used by MuddyWater.), STARWHALE(STARWHALE is Windows Script File (WSF) backdoor that has been used by MuddyWater, possibly since at least November 2021; there is also a STARWHALE variant written in Golang with similar capabilities. Security researchers have also noted the use of STARWHALE by UNC3313, which may be associated with MuddyWater.)"
G0129,"Mustang Panda(Mustang Panda is a China-based cyber espionage threat actor that was first observed in 2017 but may have been conducting operations since at least 2014. Mustang Panda has targeted government entities, nonprofits, religious, and other non-governmental organizations in the U.S., Europe, Mongolia, Myanmar, Pakistan, and Vietnam, among others.) using the following: RCSession(RCSession is a backdoor written in C++ that has been in use since at least 2018 by Mustang Panda and by Threat Group-3390 (Type II Backdoor).)"
G0019,"Naikon(Naikon is assessed to be a state-sponsored cyber espionage group attributed to the Chinese People’s Liberation Army’s (PLA) Chengdu Military Region Second Technical Reconnaissance Bureau (Military Unit Cover Designator 78020). Active since at least 2010, Naikon has primarily conducted operations against government, military, and civil organizations in Southeast Asia, as well as against international bodies such as the United Nations Development Programme (UNDP) and the Association of Southeast Asian Nations (ASEAN). While Naikon shares some characteristics with APT30, the two groups do not appear to be exact matches.) using the following: RARSTONE(RARSTONE is malware used by the Naikon group that has some characteristics similar to PlugX.), RainyDay(RainyDay is a backdoor tool that has been used by Naikon since at least 2020.), HDoor(HDoor is malware that has been customized and used by the Naikon group.), Aria-body(Aria-body is a custom backdoor that has been used by Naikon since approximately 2017.), Nebulae(Nebulae Is a backdoor that has been used by Naikon  since at least 2020.), WinMM(WinMM is a full-featured, simple backdoor used by Naikon.), Sys10(Sys10 is a backdoor that was used throughout 2013 by Naikon.), SslMM(SslMM is a full-featured backdoor used by Naikon that has multiple variants.)"
